{
  "version": "tessera/v0.1",
  "type": "delegation",
  "tessera_id": "11111111-1111-4111-8111-111111111111",
  "issuer": {
    "user_handle": "alice",
    "user_master_pubkey": "Yr_XKftXFcBEH1LtlxKubWWMh25AMCgC8M20ikpA-wc",
    "device_pubkey": "Yr_XKftXFcBEH1LtlxKubWWMh25AMCgC8M20ikpA-wc",
    "device_delegation_hash": ""
  },
  "claim": {
    "loa": 0,
    "issued_at": "2026-05-08T17:00:00.000Z"
  },
  "type_payload": {
    "delegated_pubkey": "lXC7FDh-dcPy0HUD_qsVriePjhvjndUvGTmezpnskAM",
    "device_name": "alice-test-device",
    "device_platform": "test",
    "scope": [
      "sign:authorship",
      "sign:revocation"
    ],
    "valid_from": "2026-05-08T17:00:00.000Z",
    "valid_until": "2099-01-01T00:00:00.000Z"
  },
  "biometric_attestation": {
    "method": "none"
  },
  "anchor": {
    "service": "opentimestamps",
    "ots_proof": "q6urq6urq6urq6urq6urq6urq6urq6urq6urq6urq6urq6urq6urq6urq6urq6urq6urq6urq6urq6urq6urqw"
  },
  "signature": {
    "algorithm": "Ed25519",
    "value": "i0uOkdHBtZNilmwxJecxHy_vd6Tgi-Mlsx_qqPqm5fKIHbYvziphxH7E7Jgae2z7YVamC4uSUCrRWsDcOI2QCA"
  }
}
